{
  "$schema": "https://json-schema.org/draft/2020-12/schema",
  "$id": "https://focx.ai/contracts/run.schema.json",
  "title": "Run manifest (00-run.json)",
  "description": "Written by intake automation the moment a trigger fires. The root of the audit trail.",
  "type": "object",
  "required": ["runId", "trigger", "prompt", "createdAt", "branch"],
  "additionalProperties": false,
  "properties": {
    "runId": { "type": "string", "pattern": "^run-[0-9]{8}-[0-9]{6}-(ticket|manual|grok|grok-scheduled)$" },
    "trigger": {
      "type": "object",
      "required": ["source"],
      "additionalProperties": false,
      "properties": {
        "source": { "enum": ["ticket", "manual", "grok", "grok-scheduled"] },
        "issueNumber": { "type": "integer", "description": "Present when source=ticket" },
        "actor": { "type": "string", "description": "GitHub login or bot identity that fired the trigger" },
        "requestedBy": { "type": "string", "description": "Human on whose behalf a bot acted, when known" },
        "workflowRunId": { "type": "string", "description": "GitHub Actions run id, for log traceability" },
        "paperclipTaskId": { "type": "string", "description": "Present once the run is dispatched or tracked by a Paperclip task, per the 2026-09-01 Option B decision" }
      }
    },
    "prompt": { "type": "string", "minLength": 1, "description": "The raw request text as received, unedited" },
    "mode": { "enum": ["build", "research"], "default": "build" },
    "createdAt": { "type": "string", "format": "date-time" },
    "branch": { "type": "string", "pattern": "^(run/|[A-Z][A-Z0-9]*-[0-9]+-)", "description": "run/<run-id> when intake automation cuts the branch; <issuePrefix>-<issue>-<slug> when the run happens inside a Paperclip per-issue worktree, with the prefix taken from the company record, never assumed. Recording the branch the run was actually on is the point — this is the root of the audit trail." }
  }
}
